{
  "schema_version": "2.0.0",
  "product_kind": "beverage",
  "analysis_metadata": {
    "provider": "manual_visual_review",
    "model": "human_reviewed_visible_pixels",
    "prompt_version": "product_analysis_v2_brand_crosscheck",
    "analyzed_at": "2026-07-23T00:00:00+09:00",
    "confidence": 0.96,
    "brand_crosscheck": "not_needed",
    "identity_override": "manual_pixel_review"
  },
  "source_binding": {
    "pixel_sha256": "24c120872ceb6aa093f3b441fcd6a57575c9aed4abb4f1f2a70bfd6ed6e80712",
    "width_px": 960,
    "height_px": 1280,
    "dhash": "347714397998383a",
    "mean_rgb": [
      0.673585,
      0.595922,
      0.496234
    ]
  },
  "product_summary": "An iced matcha milk latte in a tall clear tumbler: natural deep green matcha in the upper half, pale milk below, irregular clear ice and fine surface bubbles. This Wood Handheld preset preserves the complete user cup and must show a credible visible sidewall in the lower hand.",
  "identity": {
    "beverage": "iced matcha milk latte",
    "container": {
      "class": "tall clear tumbler in the source image; preserve the complete source cup in this preset",
      "material": "clear transparent glass or plastic from the source",
      "geometry": "source vessel is tall and gently tapered; preserve its rim, wall, base and sidewall under the new high-oblique window camera",
      "components": [
        "iced matcha milk beverage",
        "irregular transparent ice cubes",
        "thin natural surface foam"
      ]
    },
    "branding": {
      "state": "verified_absent",
      "main_text": null,
      "visible_text": [],
      "non_text_mark": null,
      "placement": "no intentional branding or readable text should be added",
      "colors": [],
      "confidence": 0.98
    },
    "must_preserve": [
      "iced matcha milk latte identity",
      "deep natural matcha green concentrated toward the upper layer",
      "pale milky lower layer with soft irregular green diffusion",
      "multiple irregular clear ice cubes and small surface bubbles",
      "complete source cup sidewall, rim and base in preserve-source mode",
      "visible side layers under one neutral wood-window exposure",
      "no invented logo, text, fruit, cream scoop, garnish or straw"
    ],
    "serving_state": {
      "schema_version": "1.0.0",
      "temperature": "iced",
      "ice_presence": "present",
      "straw_requirement": "none",
      "topping_requirement": "none",
      "side_visibility_requirement": "required",
      "confidence": 0.97,
      "evidence": [
        "clear ice is visible across the upper beverage",
        "green matcha and pale milk form a soft vertical color relationship",
        "small bubbles and translucent highlights are visible around the ice"
      ]
    }
  },
  "geometry": {
    "container_bbox": {
      "left": 0.248,
      "top": 0.297,
      "right": 0.737,
      "bottom": 0.845,
      "confidence": 0.96
    },
    "subject_bbox": {
      "left": 0.245,
      "top": 0.292,
      "right": 0.741,
      "bottom": 0.849,
      "confidence": 0.95
    },
    "beverage_bbox": {
      "left": 0.263,
      "top": 0.322,
      "right": 0.722,
      "bottom": 0.817,
      "confidence": 0.95
    },
    "straw": {
      "present": false,
      "bbox": null,
      "centerline": null,
      "emergence_point": null,
      "angle_degrees": null
    },
    "interaction_bbox": null
  },
  "visual_anchor": {
    "feature": "natural matcha-green upper layer, pale milky lower layer, irregular clear ice and fine bubbles under warm cafe light",
    "emphasis_method": "preserve the relative green-to-milk gradient, ice translucency and small bubbles while matching the reference scene exposure, diffuse light and contact shadow",
    "do_not_exaggerate": [
      "green saturation",
      "ice clarity",
      "foam thickness",
      "contrast between milk and matcha",
      "condensation"
    ]
  },
  "adaptable": [
    "source background",
    "source camera crop",
    "source table",
    "source hand",
    "source light and shadow"
  ],
  "discarded_source_context": [
    "source cafe wall and table",
    "source furniture",
    "source camera crop",
    "source hand and clothing",
    "source lighting and shadow"
  ],
  "source_capture_assessment": {
    "issues": [
      "source is a vertical close crop with a tall vessel and a large neutral tabletop field",
      "source light is warmer and more frontal than the approved white close-up scene"
    ],
    "evidence": [
      "ice, milk and matcha layers remain readable",
      "the glass wall and lower contact area are visible"
    ]
  },
  "presentation_correction": {
    "enabled": true,
    "intent": "reconstruct the exact attached iced matcha milk beverage and complete source tumbler in the lower-centre Wood Handheld two-person scene, held by the 6 o'clock hand with sidewall layers visible",
    "preferred_capture": {
      "focal_length_mm": [
        45,
        52
      ],
      "camera_distance": "high-oblique two-person cafe distance",
      "camera_height": "58-64 degree downward window-side observation",
      "rotation": "follow the dedicated iced pose hint: rim center left of base center, never an eye-level cup rotated in 2D"
    },
    "allowed": [
      "re-light beverage optics under target window light",
      "preserve source cup geometry and visible sidewall",
      "reconstruct natural hand grip",
      "adjust scale only within target held-slot corridor"
    ],
    "forbidden": [
      "replace source cup with a ceramic hot cup",
      "flatten to a top-only cup view",
      "remove ice or layers",
      "invent straw, logo, fruit, cream or garnish",
      "retain source background, source hand or source shadow",
      "turn matcha neon or milk paper-white"
    ]
  }
}
