{
  "schema_version": "2.0.0",
  "product_kind": "beverage",
  "analysis_metadata": {
    "provider": "manual_visual_review",
    "model": "human_reviewed_visible_pixels",
    "prompt_version": "product_analysis_v2_brand_crosscheck",
    "analyzed_at": "2026-07-23T00:00:00+09:00",
    "confidence": 0.96,
    "brand_crosscheck": "not_needed",
    "identity_override": "manual_pixel_review"
  },
  "source_binding": {
    "pixel_sha256": "24c120872ceb6aa093f3b441fcd6a57575c9aed4abb4f1f2a70bfd6ed6e80712",
    "width_px": 960,
    "height_px": 1280,
    "dhash": "347714397998383a",
    "mean_rgb": [
      0.673585,
      0.595922,
      0.496234
    ]
  },
  "product_summary": "An iced matcha milk latte whose beverage identity, matcha-to-milk color relationship, irregular ice and fine surface bubbles must be reconstructed inside the preset's compact off-white ceramic reference mug.",
  "identity": {
    "beverage": "iced matcha milk latte",
    "container": {
      "class": "compact off-white ceramic reference mug",
      "material": "matte off-white glazed ceramic",
      "geometry": "short compact cylindrical body, gently rounded lower wall, thin rim and one small loop handle",
      "components": [
        "iced matcha milk beverage",
        "irregular transparent ice cubes",
        "thin natural surface foam"
      ]
    },
    "branding": {
      "state": "verified_absent",
      "main_text": null,
      "visible_text": [],
      "non_text_mark": null,
      "placement": "no intentional branding or readable text should be added",
      "colors": [],
      "confidence": 0.98
    },
    "must_preserve": [
      "iced matcha milk latte identity",
      "deep natural matcha green and pale milk color relationship",
      "multiple irregular clear ice cubes and small surface bubbles",
      "natural matcha diffusion into the milk without paper-white separation",
      "no invented logo, text, fruit, cream scoop, garnish or straw"
    ],
    "serving_state": {
      "schema_version": "1.0.0",
      "temperature": "iced",
      "ice_presence": "present",
      "straw_requirement": "none",
      "topping_requirement": "none",
      "side_visibility_requirement": "optional",
      "confidence": 0.97,
      "evidence": [
        "clear ice is visible across the upper beverage",
        "green matcha and pale milk form a soft vertical color relationship",
        "small bubbles and translucent highlights are visible around the ice"
      ]
    }
  },
  "geometry": {
    "container_bbox": {
      "left": 0.248,
      "top": 0.297,
      "right": 0.737,
      "bottom": 0.845,
      "confidence": 0.96
    },
    "subject_bbox": {
      "left": 0.245,
      "top": 0.292,
      "right": 0.741,
      "bottom": 0.849,
      "confidence": 0.95
    },
    "beverage_bbox": {
      "left": 0.263,
      "top": 0.322,
      "right": 0.722,
      "bottom": 0.817,
      "confidence": 0.95
    },
    "straw": {
      "present": false,
      "bbox": null,
      "centerline": null,
      "emergence_point": null,
      "angle_degrees": null
    },
    "interaction_bbox": null
  },
  "visual_anchor": {
    "feature": "natural matcha-green upper layer, pale milky lower layer, irregular clear ice and fine bubbles under warm cafe light",
    "emphasis_method": "preserve the relative green-to-milk gradient, ice translucency and small bubbles while matching the reference scene exposure, diffuse light and contact shadow",
    "do_not_exaggerate": [
      "green saturation",
      "ice clarity",
      "foam thickness",
      "contrast between milk and matcha",
      "condensation"
    ]
  },
  "adaptable": [
    "source background",
    "source camera crop",
    "source table",
    "source hand",
    "source light and shadow"
  ],
  "discarded_source_context": [
    "source cafe wall and table",
    "source furniture",
    "source camera crop",
    "source hand and clothing",
    "source lighting and shadow"
  ],
  "source_capture_assessment": {
    "issues": [
      "source is a vertical close crop with a tall vessel and a large neutral tabletop field",
      "source light is warmer and more frontal than the approved white close-up scene"
    ],
    "evidence": [
      "ice, milk and matcha layers remain readable",
      "the glass wall and lower contact area are visible"
    ]
  },
  "presentation_correction": {
    "enabled": true,
    "intent": "transfer only the exact iced matcha beverage identity into the compact off-white ceramic reference mug held by the lower bare hand",
    "preferred_capture": {
      "focal_length_mm": [
        45,
        52
      ],
      "camera_distance": "high-oblique two-person cafe distance",
      "camera_height": "48-56 degree downward window-side observation",
      "rotation": "small natural hand-driven rotation only"
    },
    "allowed": [
      "re-light beverage optics under target window light",
      "adopt the verified compact ceramic reference mug",
      "reconstruct a natural hand grip around the adopted mug",
      "adjust scale only within the target held-slot corridor"
    ],
    "forbidden": [
      "retain the source tall transparent tumbler",
      "copy reference latte art or crema",
      "remove ice or the matcha-milk color relationship",
      "invent straw, logo, fruit, cream or garnish",
      "retain source background, source hand or source shadow",
      "turn matcha neon or milk paper-white"
    ]
  }
}
